{
  "format": "trainercam.acceptance-config",
  "schema_version": 1,
  "samples": {
    "tutor_session": "data/samples/tutor_session",
    "customer_session": "data/samples/customer_session",
    "profile": "config/exercises/arm_raise.json"
  },
  "regression": {
    "expected_overall_score": 100.0,
    "score_tolerance": 0.01,
    "minimum_required_joint_coverage": 1.0,
    "expected_alignment_path_length": 4
  },
  "performance": {
    "maximum_offline_artifact_seconds": 10.0
  },
  "privacy": {
    "allowed_sample_paths": [
      ".gitkeep",
      "README.txt",
      "customer_session/frames.jsonl",
      "customer_session/output2.txt",
      "customer_session/session.json",
      "tutor_session/frames.jsonl",
      "tutor_session/output2.txt",
      "tutor_session/session.json"
    ]
  }
}
